{
  "created_at": "2026-01-01T00:00:12Z",
  "created_by": "tool:sol_executor",
  "derived_from": [
    "cell:cell_014",
    "run:run_008"
  ],
  "evidence_type": "metric_table",
  "record_id": "evidence_011",
  "record_type": "sol:record/evidence",
  "source_object": "object:sha256:99127af9061e47cd302c3381a4248bd2e06032e3840a4b2be03c585cce1c9ed6",
  "source_ref": "cell:cell_014#metrics_table",
  "status": {
    "lifecycle": "active",
    "staleness": "current",
    "verification": "unverified"
  },
  "summary": "Metrics table showing M200 has a lower EOS rate than M0.",
  "supports": [
    "record:claim_007"
  ]
}
