{
  "concordance": {
    "metric": "eos_rate_delta",
    "tolerance": 0.001,
    "type": "tolerance"
  },
  "created_at": "2026-01-01T00:10:00Z",
  "evidence": [
    "run:run_012",
    "object:sha256:04e8bd270c0c885f199658780837b8be5bba7de37a3e8701ffd33c3e0b3127a3"
  ],
  "method": "sol:verify/reexecution",
  "performed_by": "tool:sol_executor",
  "record_id": "verification_005",
  "record_type": "sol:record/verification",
  "result": "passed",
  "status": {
    "lifecycle": "active",
    "staleness": "current",
    "verification": "unverified"
  },
  "summary": "Reexecution verification of claim_007.",
  "target": "record:claim_007"
}